agency,user_bureau,application_name,year_activated,application_description,database_contents,status,confidentiality,method_of_access,pdf_page
DEPARTMENT OF FINANCE,,FAIRTAX - Collections,1992,Central processing billing a collection of all taxes not paid When due.,"Warrants information, account periods.",R,,,81
DEPARTMENT OF FINANCE,,Property System,Unknown,"Records information on property descriptions, exemptions, abatements assessments, remissions.","Abatements, exemptions, revisions, property type, assessment values, names, addresses, EIN/SSN.",R,,,81
FINANCIAL INFORMATION SERVICES AGENCY,,Integrated Financial Management system,1978,"IFHS monitors the budget and performs all accounting functions for all City of New York agencies; it is the backbone of the City's financial infrastructure. IFHS processes all of the data concerning the City's bUdgets, accounting and vendor payments, and furnishes the Comptroller with pertinent financial data. simply described, it is a central computerized general ledger for all City agencies.","Financial accounting, accounts receivable, accounts payable, capital budget/expenditures, city vendors, capital construction contracts, purchase contracts, service contracts, financial reporting, vendor payments, purchase requisitions/orders, economic/financial statistics, vendor history.",,,,83
FINANCIAL INFORMATION SERVICES AGENCY,,Payroll Management System,1983,"PHS is a computerized system that prepares the payroll for all city of New York municipal employees; it provides prompt payment of overtime, other premium and retroactive pay and allows accurate and up-to-date City personnel record keeping. PHS is a central and integrated payroll, timekeeping and personnel system for the entire City of New York.","Wage reporting, municipal employees salaries, personnel record, pension payroll, employee transactions, employee overtime, employee attendance, city employee payroll, city employee absence/leave/statistics, address directory, employee absences.",,,,83
FIRE DEPARTMENT,,BZCS 80/Daily-KTD-YTD Fire statistical System (BZS 80),1982,,Fire alarms/dispatches.,,,,85
FIRE DEPARTMENT,,computerized Alarm Assignment System (CAAS),1980,,Fire alarms/dispatches.,,,,85
FIRE DEPARTMENT,,critical Information Dispatch system (CIDS),1985,,"Fire alarms/dispatches, fire hazards.",,,,85
FIRE DEPARTMENT,,Mapper Systems (Mapper),1982,,"Building modifications/repairs, computer hardware inventory, manpower schedules.",,,,85
FIRE DEPARTMENT,,Fire Prevention Information Management System (FPIMS),1984,,"Fire licenses/permits, fire code inspections/violations, local law compliance inspections, miscellaneous billings, accounts receivable.",,,,86
FIRE DEPARTMENT,,Manpower Analysis Reports (HAG),1984,,"Manpower schedules, manpower reports/statistics.",,,,86
FIRE DEPARTMENT,,Daily' Monthly Fire Reports,1980,,Fire alarms/dispatches.,,,,86
FIRE DEPARTMENT,,National Fire Information Reporting system (NFIRS),1978,,Fire alarms/dispatches.,,,,86
FIRE DEPARTMENT,,Starfire (Starfire),1980 . APPLZCATZON DESCRZPTZON,,Fire alarms/dispatches.,,,,87
FIRE DEPARTMENT,,"weighted, Response Index (WRZ)",1968,,Fire alarms/dispatches.,,,,87
DEPARTMENT OF GENERAL SERVICES,,capital Funds Monitoring system (CFHS),1985,"This is an online system with batch support function. The system monitors all capital projects, contracts and change orders on a daily basis. The system will monitor all payments to contractors.",· Contractor payments; capital construction projects; contractors; capital change orders.,,,,89
DEPARTMENT OF GENERAL SERVICES,,Commodity Line Item Purchasing System (CLZPS),1985,"The Commodity Line Item purchasing System (CLZPS) is currently employed by the Department of General Services' Division of Municipal supplies through which approximately $500 million in purchases are processed annually. Major functions within the procurement process which are addressed by CLZPS are: Requisition processing, Bid Processing, Bid Tabulation, Bid Award Process, Purchase order/Direct Order Process and Vendor processing.","All Purchase requisition, bid, contract and purchase order related information including vendor database.",,,,89
DEPARTMENT OF GENERAL SERVICES,,Storehouse Inventory,1962,An inventory management system employed by the DGS Central Storehouse which is responsible for the warehousing and Distribution of items commonly used throughout City agencies.,Inventory; Agency usage data; inventory pricing; client agency locations.,,,,89
DEPARTMENT OF GENERAL SERVICES,,Fleet Administration Maintenance Information system (FAMIS),1989,"This system tracks City owned vehicles, their usage and maintenance history. The system also keeps track of the vehicle parts inventory. This system was identified by the Mayor's Private Sector survey as not being able to meet the changing environment of the Fleet manager and the Office of Fleet Administration. The Office of Management Information Systems is currently managing the project to rewrite FAMIS. The new system, Fleet Administration computerized Tracking System (FACTS), will address all aspects of: equipment management, materials management and enhanced data retrieval.","Vehicle inventory; parts inventory; work orders, maintenance history; labor and downtime data.",,,,90
DEPARTMENT OF GENERAL SERVICES,,Fuel utilization Monitoring Equipment system (FUMES),1983,This system monitors fuel usage of NYC vehicles at City owned pumping sites.,"Vehicle fuel usage, fuel allocation.",,,,90
DEPARTMENT OF GENERAL SERVICES,,Tenant Accounting System,1982,"This system bills tenants of the Division of Real Property for rent, usage and occupancy fees, and other charges. Bills are sent monthly. Late charges, if applicable, are calculated monthly and dunning letters are sent. Includes collections. Interfaces with IPIS for enforcement data.",Tenant descriptive data; premise data; lease financial terms; current balances; billing and payment history; collection data; insurance data; enforcement summary data; multiple­ property data.,,,,90
DEPARTMENT OF GENERAL SERVICES,,Mortgage Accounting / Sales Receivable System,1982,"This system bills for mortgages created as a result of sales conducted by the Division of Real property. Bills are sent monthly. Late charges, if applicable, are calculated monthly and dunning letters are sent. Also tracks receivables resulting from DRP sales, and records defaults.",. Mortgagee descriptive data; premise data; mortgage financial terms; current mortgage balances; billing and payment history; current receivable balances; enforcement data; multiple­ property data.,,,,91
DEPARTMENT OF GENERAL SERVICES,,Integrated Property Information system (IPIS),1985,"This system tracks an inventory of City-owned and City Interest properties. Tracks various DRP and non-DRP processes affecting these properties. Monitors city acquisitions and dispositions. Correlates data with DOF files, Geosupport system, DRP Tenant Accounting system, DRP Mortgage Accounting / Sales Receivable system, and HPD Tenant system, and maintains a file of discrepancies between these files. Maintains a central name index of all people doing business in real estate with the City. Inventories all properties leased-in by the City. Records agency needs and tracks the resolution of those needs. supports the City Land Committee meeting schedule.","Property descriptive data; district data; land use regulation data; zoning data; inspection data; management data; actions required; address data; deed data; Fee Title (ownership) data; In Rem process data; condemnation data; negotiated purchase data; other acquisition data; auction data; negotiated sale data; release data; other disposition data; lease-out data; lease-in data; lease enforcement data; restrictions on use; pre-closing obligations; restrictive covenants; easements; jurisdiction/assignments , surrenders; City Land committee requests and meeting history; use data; office data; ulurp data; appraisal data; fencing requests and actions; agency needs; central name index; Dept. of Finance data.",,,,91
DEPARTMENT OF HEALTH,,PC Network To Link Field sites,1987,A system used to capture information on women being served in the department's infant mortality prevention activities.,"Miscellaneous statistics, housing/population statistics, economic/financial statistics, demographic statistics, program reports, preventable diseases, other, management reporting, health records/reports/statistics, health/confidential, education programs, children/confidential, child care, birth records.",,Public Health Law Sec. 2805-q(3) 10 New York Code Rules' Reg. Sec. 751.9(m). civil Practices Law and Rules Sec. 4504(a).,,93
DEPARTMENT OF HEALTH,,BPC Code Enforcement - On-Line MF,1986,A system which accesses ownership data at the Department of Finance for Pest Control Billing purposes.,"City owned properties, real property ownership, property owners.",,,,93
DEPARTMENT OF HEALTH,,Daycare Master File,1985,Includes information regarding day-care centers used in the inspection and regulation of day care centers.,"Child care programs, child care, daycare centers.",,,,93
DEPARTMENT OF HEALTH,,Daily Time Sheet - Data Entry Wang,1985,Inspector's Daily Time Sheet Information.,"Research/planning, projects/programs, building/structure inspections.",,,,94
DEPARTMENT OF HEALTH,,Day Camp Inspection Reports Data Center VS-65,,"Day camp Inspection Report forms, which record the outcome of inspections.","Other complaints, health licenses/permits, environmental inspections/violations, inspection reports, public complaints, health inspections.",,,,94
DEPARTMENT OF HEALTH,,Inspection Report Forms - Data Entry,1985,"Inspection outcomes fob restaurants, public health engineering, radiation inspection and other permitted establishments.","Health inspections, public complaints, inspection reports, health licenses/permits, health code inspections/violations, other complaints.",,,,94
DEPARTMENT OF HEALTH,,Retrovirology' Immunobiology Lab System,1988,Tracks specimens and test results for HIV and related virus testing.,"Client directory, public assistance/program.",,"Public Health Law Sec. 2805-q. 10 New York Codes Rules' Reg. Sec. 751.9(m), Part 63, 24-1.2. civil Practice Law and Rules Sec. 4504(a). Public Health Law Article 27-F(a). HYCHC Sec. 11.07. Public Health Law Sec. 206(1)(j).",,95
DEPARTMENT OF HEALTH,,Lead Poisoning Control System - On-Line,1982,On-line case management system for environmental and medical follow-ups on confirmed cases of Lead Poisoning and results of Lead Tests.,"City employee skills inventory, child care, registrations.",,Public Health Law Sec. 2805-q(3). 10 New York Codes Rules' Reg. Sec. 751.9(m). civil Practice Law and Rule Sec. 4504(a). HYCHC Sec. 11.07.,,95
DEPARTMENT OF HEALTH,,Case Tracking system - ME,1989,contains tracking information regarding autopsies and related medical information.,,,New York City Charter Sec. 557(q).,,95
DEPARTMENT OF HEALTH,,Radioactive Materials License Data Base,1990,Licensing Process-Tracking database of requirements for Radiation Licenses.,"Address directory, other complaints, administrative reports, environmental inspections/violations,· health' code inspections/ violations, health licenses/permits, inspection reports, health inspections, publip safety inspections, miscellaneous statistics.",,,,96
DEPARTMENT OF HEALTH,,Tuberculosis Control System - Central,1981,"CICS system that allows user to add, update, display, delete and search TB patients and their contacts by name. This is a case management system that contains demographic, medical, bacteriology, susceptibility history.",Registrations.,,"Public Health Law Sec. 2805-q(3), Sec. 2221. 10 New York Codes Rules and Regs. Sec. 751.9(m). civil Practice Law and Rules Sec. 4504(a). 10 NYCRR section 2.17. New York City Health Code Sec. 11.07.",,96
DEPARTMENT OF HEALTH,,AIDS Reporting system,,Medical and case tracking system related to HIV patients.,"Senior citizens care, inmates, geographies/maps, goals/mandates /objectives, research/planning, death certificates, demographic statistics, health records/reports/statistics. CONPIDENTXALITYREQUXREMENTS Public Health Law Sec. 206(i)(j). New York City Health Cod. Sec. 11.07(a)(2). 10 New York Codes Rules and Regulations Sec. 24-1.2 and 63.1 et seg. Public Health Law Article 27-F(a).",,,,97
DEPARTMENT OF HEALTH,,Births On-Line Record Retrieval,1981,An on-line system for accessing confidential Birth Records data required for the issuance of Birth Records certification to the individual.,Birth records.,,Administrative Code 17-169. Health Code Sec. 201.07.,,97
DEPARTMENT OF HEALTH,,Induced Termination,1971,Confidential Information regarding the circumstances for an induced termination of pregnancy.,Immigration statistics.,,Health Code Sec. 203.07(c).,,97
DEPARTMENT OF HEALTH,,Lab Improvements STD,,"Results of Lab Inspections, including personnel qualifications and adherence to standards, for the issuance of Lab permits.","Health inspections, dataline reporting system, registrations, financial reporting, child care programs, child care.",,,,98
DEPARTMENT OF HEALTH,,Handicapped Children,1950,Invoice information containing medical and payment information for service to handicapped children; does not include identifying information.,Handicapped children.,,,,98
DEPARTMENT OF HEALTH,,Hepatitis,,A confidential record of persons who tested positive for hepatitis.,Health/confidential.,,Public Health Law section 2805-g(3) 10 New York Codes Rules' Reg. Sec. 751.9(m). civil Practice Law and Rule 4504(a). Health Code Sec. 11.07.,,98
DEPARTMENT OF HEALTH,,Diagnostic Immunology Proficiency Testing,1987,"system contains records of patients enrolled in Department of Health Clinics, records of individual visits and records of provider services. System is also used for medicaid billing, and maintains records of payments and accounts receivable.","Accounts receivable, financial accounting, administrative reports, aUdits, fee collections/accounting, health records/ reports/statistics, management reporting, revenue collection, demographic statistics, economic/financial statistics, medicaid program. CONFZDENTZALZTYREQUZREHENTS Public Health Law section 2805-g(3). 10 Bew York Codes Rules' Reg. Sec. 751.9(m). civil Practice Law' Rules Sec. 4504(a). 42 CFR Sec. 431.300 et seg. Public Officers Law Article 6-A. Social Services Law Sec. 369(3)",,,,99
DEPARTMENT OF HEALTH,,Permit On-Line System,1976,An on-line record of permitted establishments and individuals.,"Daycare centers, vendor licenses/permits, health licenses/ permits.",,Public Health Law Section 2805-q(3). 10 New York Codes Rules' Reg. Sec. 751.9(m). civil Practice Law and Rules Sec. 4504 (A).,,100
DEPARTMENT OF HEALTH,,"vital Records , statistics",,Updates birth certification file and death on-line lookup file; prints birth and death registers and statistical reports; produces monthly tapes for Federal and State agencies.,"Child care, miscellaneous statistics, death certificates, birth records, administrative reports.",,"Public Health Law Sec. 2805-q(3) 10 New York Codes Rules and Reg. Sec. 751.9(m). Health Code Sees. 201.07, 205.07, and 207.11. New York City Administrative Code Sec. 17-169.",,100
DEPARTMENT OF HEALTH,,Preventable Disease,1982,A PC-based systea for tracking reported information regarding approximately 80 communicable diseases.,Preventable diseases.,,"Public Health Law Sec. 28,05-q(3). 10 New York Codes Rules' Reg. Sec. 751.9(m). civil Practice Law and Rules Sec. 4504(a). Health Code Sec. 11.07.",,101
DEPARTMENT OF HEALTH,,sexually Transmitted Disease On-Line System,1984,"A syphilis registry, keeping patient histories, including tests, diagnoses, and treatments, for on-line use.",contagious diseases.,,Public Health Law Sec. 2805-q(3). 10 New York Codes Rules' Reg. Sec. 751.9(m). Civil Practice Law and Rule Sec. 4504(a). 10 NYCRR Sec. 2.32. Health Code Sec. 11.07(a)(2). Public Health Law Sec. 2306.,,101
DEPARTMENT OF HEALTH,,Venereal Disease,1950,"A file of cases of sexually transmitted diseases, for batch processing.",Preventable diseases.,,"Public Health Law Sec. 28,05-g(3). 10 New York Codes Rules and Regs. Sec. 751.9(m). civil Practice Law and Rules Sec. 4504(a). 10 NYCRR Sec. 2.32. Health Code Sec. 11.07(a) (2). Public Health Law Sec. 2306.",,102
DEPARTMENT OF HEALTH,,Prevention of Perinatal Aids Transmission,1989,Tracks medical treatment of infants born with HIV virus.,"Miscellaneous statistics, demographic statistics, research/ planning, grants/specific funded programs.",,Public Health Law Sec. 2805-g(3). 10 New York Codes Rules and Regs. Sec. 751.9(m). civil Practice Law and Rules Sec. 4504(a). Public Health Code Sec. 206(1) (j). 10 NYCRR Sec. 24-1.2. Public Health Law Article Sec. 27-F (a). 10 NYCRR Part 63.,,102
DEPARTMENT OF HEALTH,,vital statistics Special Request On-Line MF,,"Tapes created for Federal, State, other agencies and institutions. Reports are usually listings of selected data.","Health records/reports/statistics, death certificates, research/planning.",,"Names Confidential. Public Health Law Sec. 2805-G(3). 10 NYCRR Sec. 751.9(m). New York Administrative Code Sec. 17-169. Health Code Sec. 201.07, 205.07, and 207.11.",,103
DEPARTMENT OF JUVENILE JUSTICE,,custody Control system,1983,"and DATABASE CONTENTS Inter-agency billings, child care, inmates, juvenile delinquent reports/statistics, juvenile delinquent, transportation, other.",,,"New York State Social services Law, section 372 (4) (A).",,109
DEPARTMENT OF JUVENILE JUSTICE,,Food services Inventory,1989,"This application keeps track of past, current inventory levels, amounts received, and amounts issued for all specified food items utilized at the Spofford Juvenile Center.",Inventory.,,,,109
DEPARTMENT OF JUVENILE JUSTICE,,Non-Secure Detention Inventory Tracking System,1989,"This application keeps track of past, current inventory levels, amounts received, and amounts issued for all specified items, for example, furniture, food, office supplies, personal hygiene supplies.",Inventory.,,,,109
DEPARTMENT OF JUVENILE JUSTICE,,Plant Management Inventory,1989,"This application keeps track of past, current inventory levels, amounts received, and amounts issued for all specified items relating to plant management, such as, carpentry and electrical items.",Inventory.,,,,110
DEPARTMENT OF JUVENILE JUSTICE,,Property Management/Fiscal Business Inventory,1989,"This application keeps track of past, current inventory levels, amounts received, and amounts issued for all specified items relating to fiscal and business inventory.",Inventory.,,,,110
DEPARTMENT OF JUVENILE JUSTICE,,Sneaker Inventory,1989,This application keeps track of all sneakers issued to residents at the spofford Juvenile Center.,Inventory.,,,,110
DEPARTMENT OF JUVENILE JUSTICE,,Visitor system,1983,"and DATABASE CONTENTS Visitors. COHFXDENTXALXTY REQUXREMENTS New York state Social Services Law, section 372 (4).",,,,,111
DEPARTMENT OF JUVENILE JUSTICE,,DJJ Fund Xnc.,1987,"This application keeps track of the type, date acquired, and amount of the following hardware, modems, monitors, printers, CPUs, keyboards, telecommunication lines, and the associated vendors, and maintenance contracts, for all users, work units, and sites at the Department of Juvenile Justice.",Balance sheet by grantor.,,,,111
DEPARTMENT OF JUVENILE JUSTICE,,Property Management Expenditures Tracking System,1988,"This application keeps track of purchase order, storehouse, and imprest Fund expenditures for the property Management department of Spofford Juvenile Center.","Balance sheet, management reporting/control.",,,,111
DEPARTMENT OF JUVENILE JUSTICE,,Volunteers Database,1990,"This application provides an address directory for all volunteers to the Department of Juvenile Justice, and keeps track of the number of hours, type of task, and the site of each volunteer's participation. DATDASE COrErS Volunteers, address directory, street name and address/Geo­ support.",,,,,112
OFFICE OF LABOR RELATIONS,,PREMIUM ACCOUNTING/CENTRALENROLLMENT SYSTEM RETIREE (PACES),1985,Processes health and Medicare reimbursement information for retired City employees.,"City retiree health information, Medicare reimbursement check information, rate tables for health insurance.",,,,114
OFFICE OF LABOR RELATIONS,,PREMIUM ACCOUNTING/CONTROLENROLLMENT SYSTEM/ACTIVE (PACES II),1990,Processes health information for City employees.,City active health information rate tables for health insurance.,,,,114
LANDMARKS PRESERVATION COMMISSION,,Permit Application Tracking System (PATS),1987,This system tracks all work permit applications received and issued since 1987.,"Landmark regulatory actions, work applications filed for designated buildings.",,,,116
LAW DEPARTMENT,,citylaw,1984,Legal research and retrieval system.,"contains the full text of Mayoral Directives and Executive Orders, formal opinions of the corporation Counsel, the opinions of the New York City Conflicts of Interest Board, and other Law Department material having precedential value. The contents of Citylaw are generally available in hard copy form through law libraries.",,,,118
LAW DEPARTMENT,,"city of New York, Workers' compensation System",1985,"Workers' compensation claims data, including claimant data, injury information, medical findings, payment transactions, worker's compensation providers, and various coding tables for locations, agencies, injuries, occupations, and payment rates.",,,,,118
NYC LOFT BOARD,,Loft Data,1983/84,"This module tracks the status of over 850 loft buildings moving through the stages of code compliance; the data base also includes violations, summonses and applications brought before the Board.","Building applications/certificates/permits; litigation cases; building code inspections/violations; fee collections/ accounting; inspection reports; building/structure inspections; local law, fire code, housing maintenance standards compliance inspections; loft board licenses/permits; other purchases; real property ownership; registrations; rent/lease payments; public non-compliance summons.",,,,120
OFFICE OF MANAGEMENT & BUDGET,,ASSET INVENTORY MANAGEMENT SYSTEMS,1990,"and DATABASE CONTENTS Background: The Charter requires that the head of each city agency submit to the mayor each year an up-to-date inventory, assessment, and schedule of maintenance activities and necessary repairs for that agency's portion of the city's capital plant. Process: j The mayor must then transmit to the city council an estimate of the amounts needed, by agency, for the required maintenance and repair activities. The condition assessments, maintenance schedules and estimates must he prepared and certified by registered engineers and,architects. Finally, the mayor shall include in the bUdget message an itemized statement detailing any differences between the amounts indicated as required and the amounts appropriated for capital plant maintenance as well as the amounts actually expended. summary: The City's physical plant is defined by the Charter to include all assets or systems with a replacement value of at least $10 million and useful life of at least ten years. Even with these restrictions, the individual assets identified and appraised in the first phase of the project number approximately 2500 and include asset types such as parks, schools, office buildings, police precincts, prominent bridges, bulkheads, and ferryboats. The city's approximately 5700 miles of streets are also included in this project. Assets leased to the Transit Authority, the NYC water Finance Authority and to other public benefit corporations are excluded from the Charter reporting requirements. The City mas chosen to include assets of the Health and Hospital corporation. This application also includes the inventory assessments, maintenance and repair activities required by the Charter.",,,,,122
